tweet_id,text,location_mentions
ID_1176705407257104391,Pakistan authorities now confirm that 19 have been killed and over 300 injured in Pakistani-administered Kashmir. So heartbreaking and distressing. I urge you all to pray sincerely for the people of #Kashmir. Theyve suffered far too much. #Earthquake,Pakistan=>COUNTRY * Kashmir=>CITY * Kashmir=>CITY
ID_1176507091969855490,19 dead over 300+ injured in earthquake ὢ2ὢ5ὢD Ya Allah rehm ker dy..ὤFὤFὤFὤF #earthquake,
ID_1176507658590916608,"#Breaking Injured are being shifted to hospitals, Says, minister state for disaster management, Raza Qadri. Read here:  #earthquake",
ID_1176489167951413249,"Earthquake : Four Dead 76 Injured, Infrastructure Damaged via @incpak  #Earthquake #Update #Latest #Pakistan #Mirpur #AzadKashmir #AJK #Punjab #Islamabad #INCPAK",Pakistan=>COUNTRY * Mirpur=>CITY * AzadKashmir=>CITY * AJK=>CITY * Punjab=>STATE * Islamabad=>CITY
ID_1176490852144812034,lot of #damage in #mirpur but worse in a village near mirpur called #jatlan. [2/2] #earthquake #Pakistan #PakistanArmy #kashmir,mirpur=>CITY * mirpur=>CITY * Pakistan=>COUNTRY * kashmir=>STATE
ID_1176915947069812737,"Quake death toll rises to 37, relief activities in full swing: DC #APPNews #Earthquake #EarthquakeinPakistan #Mirpur #AJK @ndmapk  via APP",Mirpur=>CITY * AJK=>STATE
ID_1176475746191196165,Chairman @ndmapk tells #HumNews atleast 50 injured in Kashmir #Earthquake according to initial reports.,Kashmir=>CITY
ID_1176908975444496385,"A PARS EARS team reached #earthquake hit areas last night and distributed food and edibles to local residents, total PARS teams present in area are 2 teams one on S&R and other for humanitarian aid 3rd team moving tonight shall establish a Com Link base #EarthquakeinPakistan",
ID_1176474015692722178,#Massive destruction in #Azad_Kashmir due to Strong #Earthquake as #Rescue and #Relief Service started immediately by #Pakistan_Army and Local Administration.,Azad_Kashmir=>CITY
ID_1177119896687300608,"Breaking: Earthquake in Mirpur, Jehlum, Islamabad, Lahore & surroundings (it could be a aftershocks) #EarthquakeinPakistan #earthquake",Mirpur=>CITY * Jehlum=>CITY * Islamabad=>CITY * Lahore=>CITY
ID_1176758079653892096,Several injured after bomb hits police bus in southern Turkey #Pakistan #Karachi #Lahore #Islamabad #Daily,Turkey=>COUNTRY * Pakistan=>COUNTRY * Karachi=>CITY * Lahore=>CITY * Islamabad=>CITY
ID_1176481333121622016,At least six persons have died and over 100 others injured in Mirpur district as a result of the #earthquake. Dead bodies have been shifted to the mortuary of Div HQ Hospital Mirpur. Rescue operation continues #Azad_Kashmir,Mirpur=>DISTRICT * Mirpur=>CITY * Azad_Kashmir=>STATE
ID_1176767351653580800,Social media is shit and disgusting medium . she wasnt aware about the damage and destruction . am not taking her side about her statement but at least use your tiny brains see the background and scenario of the issue Duniya kahan ponch gai hm kis level mn phansy huy,Duniya kahan=>CITY
ID_1176559642350145536,appreciated and this is the one of the best way to help our people. I request to everyone try to help our brothers and sisters who are affected in #earthquake,
ID_1176501846074175495,RT @LastQuake: Many pictures of road damage following M5.9 earthquake in #Pakistan,Pakistan=>COUNTRY
ID_1176477238608453634,Sorry For My Previous Troll On #Pakistan in the #earthquake 5 people died and 50 were injured. Hope now everyone is staying safe. WE PRAY FOR EVERYONE TO BE SAFE.,Pakistan=>COUNTRY
ID_1176468519145394178,"RT @SherySyed2: #Pakistan after Magnitude 5.8 #Earthquake Emergency declared in Azad Kashmir Road in #Mirpur, #AJK",Pakistan=>COUNTRY * Azad Kashmir=>CITY * Mirpur=>CITY * AJK=>STATE
ID_1176844810357006336,Death toll from Pakistan earthquake rises to 37 - local official. #pakistan,Pakistan=>COUNTRY * pakistan=>COUNTRY
ID_1176465712635944960,#Earthquake Destroyed road near #MirPur : Reports,MirPur=>CITY
ID_1176525251821408257,"At least 19 people were killed, over 300 injured in Kashmir #Earthquake and PM Imran Khans adviser on information and broadcasting is cracking jokes.",Kashmir=>CITY
ID_1176523073442504705,RT @Army_bratss: Roger Sir: As weve sworn to rescue and defend the People of mother land. #earthquake #Pakistan #PakistanArmy .,Pakistan=>COUNTRY
ID_1176501558755909632,#Update Army aviation helicopters have completed aerial recceonince for damage assessments. #earthquake #Pakistan,Pakistan=>COUNTRY
ID_1176465598651469825,Road broke down due to #earthquake near Sarai alamgir.,Sarai alamgir=>CITY
ID_1176494637097410564,"ان للہ و انا علیہ راجعون Hameed Ullah, student of student of Software Engineering Department 8th Semester at Mirpur University Of Science and Technology (MUST) Jumped from Hostel upper floor to rescue his life during earth quake has died. May his soul RIPὢDὢD #earthquake",Mirpur=>CITY
ID_1176519329271242759,Truly shameful. Look how happy she’s looking over a disaster that’s killed so many ppl.,
ID_1176499178349969413,There is no electricity is the affected area and phones will die fast. I hope you can contact your loved ones and tell them to preserve whatever they can as I have in this great chaos and panic everywhere. Everyone is on edge. Pray for the victims. #earthquake,
ID_1176584482394116098,"A powerful #earthquake of magnitude 5.8 shook Pakistan-administered #Kashmir and other areas in the eastern Punjab province on Tuesday, killing at least 22 people and injuring around 300 while rescue operations get underway, officials said",Pakistan=>COUNTRY * Kashmir=>CITY * Punjab=>CITY
ID_1176467260438978561,Jatla Mirpur. Roads Damaged Because Of #Earthquake.Ya Allah Khair. #earthquake,Jatla Mirpur=>CITY
ID_1176502050177372162,"Injuries reported after 6.3 #earthquake hit along #Pakistan-India border. Reportedly, Azad #Jammu and #Kashmir are badly effected, as well as Indian occupied Kashmir but no news coming out due to communication blackout imposed by India. 4 died, 50 injured",Pakistan=>COUNTRY * Azad=>CITY * Jammu=>CITY * Kashmir=>CITY * Kashmir=>CITY * India=>COUNTRY
ID_1176467265560227853,#earthquake #Mirpur #AzadKashmir @OfficialDGISPR took immediate action sent army medical teams under emergency situation.,Mirpur=>CITY * AzadKashmir=>CITY
ID_1176495140397035521,"At least five people were reportedly killed and more than 100 injured in a 5.8-magnitude earthquake that struck eastern #Pakistan and was felt in the capital, Islamabad, and several other cities. via @RFERL",Pakistan=>COUNTRY * Islamabad=>CITY
ID_1176464726836097024,News are coming from #mirpur azad kashmir. One woman death and several injuries reported. #earthquake,mirpur=>CITY * azad kashmir=>STATE
ID_1177112848666955776,We need help #mirpur #earthquake,mirpur=>CITY
ID_1176681823730094080,More than 22 killed & around 300 or more injured by the earthquake in Pakistan of 5.8 magnitude. May Allah help those who have been affected by the earthquake in our Northern areas & protect us all frm any sort of natural catastrophic disasters. Ameen #Earthquake #PrayForPakistan,Pakistan=>COUNTRY
ID_1176710231507853312,"#UPDATE 30 people lost their lives in the 5.8 earthquake that strike the Mirpur city of AJK, over 450+ injured #earthquake",Mirpur city=>DISTRICT * AJK=>CITY
ID_1176480316338388995,"Here in Azad Kashmir our Army and people are there to rescue. My Heart is wrenching what will be happening in IOK, 50 days of curfew and now Earthquake. یا اللہ رحم فرما۔۔ #earthquake",Azad Kashmir=>STATE
ID_1176483668245831680,5 dead & over 100 injured. #Earthquake #Mirpur #AJK #StaySafe,Mirpur=>CITY
ID_1176478050558664711,Four dead and more than 76 wounded in #earthquake. COAS General Qamar Bajwa directed army troops to participate in rescue activities in Azad Jammu and Kashmir and other affected areas. #ISPR #DGISPR #Islamabad #tremors #BreakingNews #Pakistan #PakistanArmy,Azad Jammu=>STATE * Pakistan=>COUNTRY
ID_1176581379657785345,26 confirmed dead & scores injured as 5.8 #earthquake hits Mirpur Azad Kashmir in Pakistan causing irreparable damage to road infrastructure & homes. Federal Minister on Information @DrFirdous_PTI chooses the day to mock & brag about tabdeeli [change] under the ground by PTI.,Mirpur=>CITY * Azad Kashmir=>STATE * Pakistan=>COUNTRY
ID_1176469289156653056,"Massive damage due to 7.1 magnitude earthquake just 12 kilometres North of Jhelum in Azad Kashmir Pakistan. Divine sign for change. May ALLAH save everyone, Aameen. #earthquake #BREAKING",Jhelum=>CITY * Azad Kashmir=>STATE * Pakistan=>COUNTRY
ID_1176528090438217729,"Aerial view collapse bridge after powerful #earthquake in #Mirpur #Pakistan Administered #Kashmir, 19 killed and 100+ injured",Mirpur=>CITY * Pakistan=>COUNTRY * Kashmir=>CITY
ID_1176931565097668611,"#JammuAndKashmir needs rescue & relief from the disastrorus earthquake @UN if in this time with natural disaster, you cannot send rescue & relief to affected Kashmiris who are under seige last from 51 days, than its better to shut down your office #earthquake",
ID_1176468256200306688,"5 dead and around 50 injured in Pakistan, after Earthquake with the magnitude of 6.3 reported on Richter scale. ( Visuals are from Mirpur area in PoK) #earthquake #Pakistan",Pakistan=>COUNTRY * Mirpur=>CITY * Pakistan=>COUNTRY
ID_1176494891809087488,19 People Dead and More than 100 Are InJured So Far In AJK ὡ3 #earthquake,
ID_1176492193298767883,RT @MurtazaViews: Damage to parts of Mangla dam in Mirpur #earthquake,Mangla dam=>HUMAN-MADE POINT-OF-INTEREST * Mirpur=>CITY
ID_1176481883766566913,RT @khaleejtimes: #BREAKING: #Pakistan army launch rescue operation in quake-hit areas,Pakistan=>COUNTRY
ID_1176469766929883136,Mirpurs disaster pictures are terrifying. May Allah protect everybody. #Mirpur #Earthquake,Mirpurs=>CITY * Mirpur=>CITY
ID_1176938426869964802,"Toll rises to 37, over 452 injured in quake in Pakistan. #pakistan",Pakistan=>COUNTRY * pakistan=>COUNTRY
ID_1176940581425205253,RT @pakistaninews: COAS directs immediate rescue and relief efforts to aid earthquake affectees. #pakistan,pakistan=>COUNTRY
ID_1176556285891883018,Alert !! 26 people died due to earth quake. 300 plus injured. #earthquake,
ID_1176489033096212482,Disgusted with Bilawal Bhutto & Ahsan Iqbal for continuing with their pathetic speeches as news of injury & damage coming in from various parts of Pakistan from the #earthquake.,Pakistan=>COUNTRY
ID_1176547889738330112,"I request my team mates from sare aam who belong to the effected areas to plz go and help the people who need you at this time. Go and help the rescue teams. This is what we pledged for, to stand with our people and for our country whenever n wherever needed. #earthquake",
ID_1176570901061668864,"IMPORTANT: If you’re in #Earthquake effected area, and you need blood, you can ring one of these numbers.",
ID_1176495767181320192,"19 people have lost their lives and 300 people are injured. If rescue operation dont start timely in every corner of the effected areas, these numbers can, God Forbid, increase. Timely action matters! #earthquake #mirpur #jhelum",mirpur=>CITY * jhelum=>CITY
ID_1176557451212152832,Earthquake Alert in Pakistan #earthquake #earthquakepakistan,Pakistan=>COUNTRY
ID_1176904506422026240,"@Muslim_Aid #Pakistans ambulance is available at the accident and emergency dept of DHQ Hospital #Mirpur. The needs and capacity gaps are being received by the Medical Superintendent of the DHQ which includes medicine services, ultrasound & x-ray machines. #EarthquakeinPakistan",Pakistans=>COUNTRY * Mirpur=>CITY
ID_1176515560739356672,Earthquake shaked every things in AJK Pakistan #earthquake #KashmirBleeds,AJK=>CITY * Pakistan=>COUNTRY
ID_1176572468808622080,"Almost 40 deaths & 700 people injured reported so far due to the #earthquake today but cabinet member @Dr_FirdousPTI laughs & tries to crack a political joke about it linking it to tabdeeli”. This is shameful, she should be sacked for this if nothing else. Sick.",
ID_1176476651762475008,The damage in Mirpur AK. #earthquake #BreakingNews,Mirpur=>CITY * AK=>STATE
ID_1176804139759734785,Death toll in #Mirpur #earthquake increases to 25 while the injured are around 452 and of them 160 are with serious injuries. One of the deceased is an armyman. #Azad_Kashmir,Mirpur=>CITY * Azad_Kashmir=>CITY
ID_1176497443350994944,RT @Ahmed_FCA: So far 300 injured and 19 died #earthquake,
ID_1176766879203037185,#Mirpur #AJK #Earthquake - Update via #NDMA (25 SEP / 1215 hrs) - 25 people died - 459 people injured - 450 houses damaged - 14 km road damaged - #Jatlan area is cleared - #ManglaDam & Power is safe #PakistanEarthquake #EarthquakeInPakistan,Mirpur=>CITY * AJK=>CITY * Jatlan=>CITY
ID_1176490747652182016,Chairman National Disaster Management Authority (#NDMA) has predicted aftershocks of the earthquake in the next 24 hours. Jatlan is the most affected area. Emergency has been imposed. #earthquake #Pakistan #Islamabad #Mirpur #Ajk #EarthquakeInPakistan #PakistanArmy #tremors,Jatlan=>CITY * Pakistan=>COUNTRY * Islamabad=>CITY * Mirpur=>CITY * Ajk=>CITY
ID_1176508055376334848,"#earthquake stats have started coming in. 19 dead, 300+ injured (so far), many houses destroyed and a whole road sunk into a river. These numbers will still change. There are people still trapped under debris.",
ID_1176555477200777217,Casualties are increasing with the passage of time.. prayers needed..May Allah protect our loved ones and keep everyone safe and sound. #earthquake,
ID_1176527492636712962,#earthquake District Disaster Management Authority #Mirpur Official Statement about casualties and injured people.,Mirpur=>CITY
ID_1176702576999510016,"20,000 Missing, 5000 Killed by #Pakistan army in Balochistan. No Accountability. JUSTICE FOR #BALOCHISTAN! @UN @UNHumanRights @UN_HRC",Pakistan=>COUNTRY * Balochistan=>STATE * BALOCHISTAN=>STATE
ID_1176464858616881154,Jehlum Road Conditions 59 people injured 3 died #earthquake,Jehlum=>CITY
ID_1176479679697620993,"What to do after an #earthquake Expect aftershocks after the main quake. Aftershocks can cause building damage and falling debris that could injure you, so be aware. Drive carefully and plan alternative routes. Be careful of traffic light outages.",
ID_1176514729755516928,BREAKING: 8 people have died and over 100 injured in a 5.8-magnitude #earthquake in northern #Pakistan. Please support the Government of Pakistan (@pid_gov) for rescue and relief efforts in this hour of crisis @DFID_UK @JoannaReid_DFID @TomDrewUK,Pakistan=>COUNTRY * Pakistan=>COUNTRY
ID_1176627263493857282,A devastating earthquake rattled #AJK resurrecting the haunting memories of a 2005 monster tremor. 5.6 magnitude earthquake also jolted several cities of #Pakistan at least 30 people dead & 350 injured. My thoughts & prayers are with those affected by the #EarthquakeinPakistan..,Pakistan=>COUNTRY
ID_1176465801810993152,RT @zubairabbasi: #earthquake Emergency declared in AJK Mirpur.,AJK=>CITY * Mirpur=>CITY
ID_1176464736860418048,"Updates: Over 100 injured, sad reports coming from Kashmir, motors & roads damages, two mosques also affected. #Pakistan #Earthquake",Kashmir=>CITY * Pakistan=>COUNTRY
ID_1176511522979405824,"RT @BXaryab: As per chairman @ndmapk 10 pepople are dead , 100 badly injured #earthquake",
ID_1176504643913998337,"> Earthquake Emergency Warning！ M 4.6 - 224km ESE of Boddam, United Kingdom USGS Magnitude 4.5+ Earthquakes, Past Hour  #地震速報 #地震情報 #Earthquake #EarthquakeEarlyWarning ＃MKNJBH #拡散希望 #相互フォロー",United Kingdom=>COUNTRY
ID_1176479005333176321,COAS directs immediate rescue operation in aid of civil administration for victims of earthquake in #AJK. #Army troops with #aviation and #MedicalSupport teams dispatched. #APPNews #earthquake #Kashmir #Mirpur,AJK=>STATE * Kashmir=>STATE * Mirpur=>CITY
ID_1176598685372899328,Shadab will donate Sri Lanka match fee to earthquake affectees. #pakistan,Sri Lanka=>COUNTRY * pakistan=>COUNTRY
ID_1176486012383612929,The people of occupied Kashmir are already facing a lot of challenges and no body knows whether they are affected by the #earthquake or not due to communication blackout.,Kashmir=>STATE
ID_1176567987618406405,"Roads , buildings heavely damaged in mirpur , bhimber ajk  Earthquake intensity 8.5 nd centre was jatlan ,Mirpur Azad Kashmir Allah sab ki hifazat fermaye Ameen #earthquake",jatlan=>CITY * Mirpur=>CITY * Azad Kashmir=>STATE
ID_1176475947081641984,"#BREAKING One dead, several injured in 5.8 magnitude #earthquake near Jhelum, Reuters quotes government official",Jhelum=>CITY
ID_1177098668375195648,"Earthquake: Death toll exceeds 35, at least 600 injured #Pakistan #Earthquake",Pakistan=>COUNTRY
ID_1176877436367233025,Minister for Interior Ijaz Ahmed Shah took briefing on relief & rescue operation after #earthquake #APPNews @MOIPakistan #Mirpur #AJK #jatlan,Mirpur=>CITY * AJK=>CITY * jatlan=>CITY
ID_1176482124662099968,"Its getting dark, and people might be stranded in areas affected by the #earthquake. I urge authorities to play their due part and start the rescue activities asap @ndmapk",
ID_1176494145071976448,"After shocks are predicted, People are told to take precautionary steps #earthquake",
ID_1176808210528968704,"I’m launching an appeal with the Human Relief Foundation .@Human_Relief with people already working on the ground for the #earthquake affectees. If you wish to help, I’ll be putting up a link shortly. Thank you ὤFἿB",
ID_1176521328322416643,Two Dacoits Killed During Robbery Bid in Karachi -  #Pakistan,Karachi=>CITY * Pakistan=>COUNTRY
ID_1176472105782849537,"EARTHQUAKE (6.1 magnitude) JUST IN: location: mirpur Azad kashmir Source: media personals 4 dead, more than 100 injured. Hospital, houses, roads collapsed. @ndmapk @OfficialDGISPR #earthquake #kashmir #mirpur #naturaldisaster #rescue #effort #azadkashmir #prayers",Azad kashmir=>STATE * kashmir=>STATE * mirpur=>CITY
ID_1176497827708592129,"#pakistanearthquake TV channels showed the footage of heavily damaged roads in Mirpur, with many vehicles overturned. #earthquake #pakistan #mirpur",Mirpur=>CITY * pakistan=>COUNTRY
ID_1176637441274449922,Focusing on rescue activities in quake-hit areas: NDMA Chairman. #pakistan,pakistan=>COUNTRY
ID_1176473460220059651,@mzsqadri Roads are badly affected Distant areas say b Atchi news nhen aa rhe. Acc to sources More than 100 people are injured and 2 dead in #AzadKashmir #Mirpur #earthquake ὢ2ὣ7 #PakArmy rescue teams have reached there .. Ya Allah Sb ki khair ho,@mzsqadri Roads=>ROAD * AzadKashmir=>CITY * Mirpur=>CITY
ID_1176870546665086976,"Download to watch LIVE:  NDMA, Pak Army playing vital role in quake rescue, relief efforts: SAPM Awan #Pak #Live #NEWS #Channel #ARYNewsLiveHD #Pakistan #WorldNews #OZOOTV #Android",Pakistan=>COUNTRY
ID_1176510899487686657,Several people died and many more injured in #earthquake but #firdousashiqawan is cracking jokes . Shameful and disgusting!,
ID_1176496499347341313,Earthquake damages in Jatlan AJK  WhatsApp Videos of earthquake damages in your area: ὏1WhatsApp: 0300-9115919 ὎2἟5἟0 #Pakistan #earthquake #Jatlan #Kashmir #AJK,Jatlan=>CITY * AJK=>STATE * Pakistan=>COUNTRY * Jatlan=>CITY * Kashmir=>CITY * AJK=>CITY
ID_1176473037488754688,"Due to #Earthquake, reports of damages from #Mirpur building collapsed 50 people injured. Rescue teams are rushing roads damaged by earthquake. It must have been felt in #IOK as well where mobile phones and internet is shut for the last 51 days Ya ALLAH Reham Farma! #Kashmir",Kashmir=>CITY
ID_1176553896677924865,"RT @AnjumIqbalPTI: Aftershocks of #earthquake expected in the #Mirpur Azad Kashmir in the next 24 hours. Please take cares, Stay Safe. http",Mirpur=>CITY * Azad Kashmir=>CITY
ID_1176882000868904967,"There is free breakfast, lunch, and dinner along with free stay for earthquake victims (families) in Kashmir Hotel and restaurant. (Mirpur Azad Kashmir). #Mirpur #Bhimber #jatlan #Azadkashmir #Pakistan",Kashmir Hotel and restaurant=>HUMAN-MADE POINT-OF-INTEREST * Mirpur=>CITY * Mirpur=>CITY * Bhimber=>CITY * jatlan=>CITY * Azadkashmir=>STATE * Pakistan=>COUNTRY
ID_1176613619683024897,"The entire District experienced the blackout, power outage & any type of radio / digital communication etc. The panic was inevitable.  #charitytuesday #pakistan #earthquake #MuslimHands #Kashmir #Earthquake2019 #SOS #Earthquake",pakistan=>COUNTRY * Kashmir=>CITY
ID_1176471577933860865,#PakArmy in action yet again for help and rescue operation in #Earthquake affected areas. @ndmapk @OfficialDGISPR #earthquake,
ID_1176816783845744646,Here is the list of the persons who lost their lives in Tuesdays #earthquake in #Mirpur district. Those who belong to #Bhimber had also died in the territorial limits of Mirpur. RIP,Mirpur=>CITY * Bhimber=>CITY * Mirpur=>CITY
ID_1176557084663582722,I extend my heartfelt condolences to the families of over 20 deaths & feel sad about 400 injured in todays earthquake in Mirpur & adjoining areas. May God Almighty rest departed souls in eternal peace and pray for quick recovery of injured ones.Ameen #earthquake,Mirpur=>CITY
ID_1176715746707161090,Natural disasters do not ask before they knock your doors. Today 5.8 magnitude earthquake hit our grounds but sehat karwan is trying to reach the affected areas. We will provide free medical and rehab facilities to the affected people and will address the casualties. #EarthQuake,
ID_1176501698245910529,#earthquake Just in Death toll: 20 Injured : 200 Source: DHQ Mirpur #mirpur #Pakistan,Mirpur=>CITY * mirpur=>CITY * Pakistan=>COUNTRY
ID_1176552090803539968,#Pakistan: At least 19 people died and over 300 injured after an #earthquake shook several parts of the country. (1/2) Indus News Live:,Pakistan=>COUNTRY
ID_1176539474291036160,"Infrastructure damaged, roads damaged 20+ casualties in Jatlan near Mirpur.These pictures are of my hometown.. @javerias @omar_quraishi @fawadchaudhry @HamidMirPAK #Mirpur #earthquake",Jatlan=>CITY * Mirpur=>CITY * Mirpur=>CITY
ID_1176786056756322305,"At least 459 people injured, #rescue operation continues in region   #Pakistan",Pakistan=>COUNTRY
ID_1176502535961677826,"Upset to see imagery of damage resulting from the #earthquake in Azad Kashmir where casualties and hundreds of injuries have been reported. As citizens, we must do all we are capable of to assist our brethren in need. May the suffering families soon find relief ὤF",Azad Kashmir=>CITY
ID_1176513301213253634,RT @falamb3: Number of deaths has now climbed to 38 and 700 injured. Let us all pray this number does now climb any further. #earthquake,
ID_1176497428989698048,#earthquake rattles #Pakistan,Pakistan=>COUNTRY
ID_1176484662249697281,"Earth in Mirpur, Kashmir & Ajk, 100 people were injuired & 5 Dead. #earthquake",Mirpur=>CITY * Kashmir=>STATE * Ajk=>CITY
ID_1176486086228566016,"#earthquake of 5.8 magnitude S shook different parts of Azad Jammu and Kashmir (AJK) to subs of Lahore ,which claimed at least two lives and 100 left injured so far #PrayForPakistan #Mirpur #AzadKashmir #Islamabad #Lahore",Azad Jammu and Kashmir=>STATE * Mirpur=>CITY * Islamabad=>CITY * Lahore=>CITY
ID_1176508054432550913,And we know nothing about the damage caused by the earthquake today #earthquake,
ID_1177149372058013696,"Heard the news from a friend who is in mirpur that due to second earthquake, walls of the mangla dam are cracked, may Allah protect us .ὡ6#earthquake",mirpur=>CITY
ID_1176495897615720448,Update: According to NDMA there are chances ot aftershocks in th3 next 24 hours. Keep safe everyone and take all precautionary measures to avoid any loss. #earthquake,
ID_1176499766366261249,Emergency Amateur Radio Services Situation PARS volunteers are on move for affected area with all req communication equipment. COAS Pakistan ordered mobilise Pakistan Army for relief and rescue efforts. Wide spread damage is being reported in Jatllan AJK #earthquake,Pakistan=>COUNTRY * Pakistan=>COUNTRY * Jatllan=>CITY * AJK=>CITY
ID_1176494137648013312,Prime Minister @ImranKhanPTI directs all the concerned departments to provide immediate assistance of all kinds to carry out relief activities in quake-hit areas. #APPNews #earthquake #Kashmir #AJK #Mirpur #Jatla,Kashmir=>CITY * AJK=>CITY * Mirpur=>CITY * Jatla=>CITY
ID_1176506581971865602,Mangla Dam safe after earthquake but 900MW reportedly lost. #pakistan,Mangla Dam=>CITY * pakistan=>COUNTRY
ID_1176490859585388544,"#earthquake Panic and damage at Mirpur Hospital. Epicenter of 5.8 Magnitude earthquake was 1.8 km away from Mirpur, POJK",Mirpur=>CITY * Mirpur=>CITY * POJK=>STATE
ID_1176511296881221632,"5.8 magnitude strong #earthquake jolts Islamabad, Rawalpindi, Gujar Khan, Mirpur, Kotli, Lahore. 21 people dead, 370+ injured. Jhelum was the epicentre. #Pakistan",Rawalpindi=>CITY * Gujar Khan=>CITY * Mirpur=>CITY * Kotli=>CITY * Lahore=>CITY * Jhelum=>CITY * Pakistan=>COUNTRY
ID_1176595161675120642,Army Chief directs troops to participate in rescue activities in earthquake-hit areas. #pakistan,pakistan=>COUNTRY
ID_1176730835711680512,"25 killed and over 400 people injured, hundreds of houses, vehicles and other infrastructure damaged, cellular phone service and electricity is suspended in rural areas after a 5.8 magnitude earthquake hits #Pakistan yesterday #EarthquakeinPakistan",Pakistan=>COUNTRY
ID_1176731931104415744,#FirdousAshiqAwan casually joke about the #earthquake without realizing that it could bring a devastating tragedy. This is beyond shocking Many peoples dead and injured and this is what #FirdousAshiqAwan has to say? Seriously? Extremely shameful insensitivity. ὡ0☹️,
ID_1176491974351872001,"Benazir Bhutto Shaheed Medical College & boys hostel in #Chitterpari, #Mirpur Azad Kashmir is also collapsed. #Pakistan after Magnitude 5.8 #Earthquake",Benazir Bhutto Shaheed Medical College=>HUMAN-MADE POINT-OF-INTEREST * Chitterpari=>CITY * Mirpur=>CITY * Pakistan=>COUNTRY
