tweet_id,text,location_mentions
ID_912465281058000898,RT @Mike_DeCillis: Maybe as the leader of the free world Germany will send humanitarian aid to Puerto Rico. #HurricaneMaria,"[{'text': 'Germany', 'type': 'Country', 'start_offset': 57, 'end_offset': 64}, {'text': 'Puerto Rico', 'type': 'Island', 'start_offset': 95, 'end_offset': 106}]"
ID_912413243242508288,RT @TheShadyFacts: Jennifer Lopez just donated $1 million to help Hurricane Maria victims in Puerto Rico. A TRUE CHARITABLE QUEEN!,"[{'text': 'Puerto Rico', 'type': 'Island', 'start_offset': 93, 'end_offset': 104}]"
ID_912421315373621248,Visitors are ordered to leave parts of Outer Banks as Hurricane Maria approaches  #MANDATORY #EVACUATION Dare Count,[]
ID_913898566502019074,RT @BonnieWeather: #supplies flying out tonight to help #puertorico #NYC #pix11 #news #hurricanemaria @ Long Island,"[{'text': 'puertorico', 'type': 'Island', 'start_offset': 57, 'end_offset': 67}, {'text': 'NYC', 'type': 'City/town', 'start_offset': 69, 'end_offset': 72}, {'text': 'Long Island', 'type': 'City/town', 'start_offset': 104, 'end_offset': 115}]"
ID_914036582503604224,Puerto Rican mayor begs for aid after Hurricane Maria  What does this do for image of US globally? bad enuf already,"[{'text': 'US', 'type': 'Country', 'start_offset': 86, 'end_offset': 88}]"
ID_910762853526773760,Extreme damage expected: Tracking Hurricane Maria  via @msnbc,[]
ID_914234850613264384,"Duncan USVI Relief:  Will match financial donations up to $1,000,000 for relief efforts in the US Virgin Islands. #HurricaneMaria #USVirginIslandRelief","[{'text': 'US Virgin Islands', 'type': 'Island', 'start_offset': 95, 'end_offset': 112}]"
ID_914182319291777024,"RT @lillys_news: Puerto Rico Recovery a Tale of Two Islands; Supplies Flowing, but Not to Remote Areas","[{'text': 'Puerto Rico', 'type': 'Island', 'start_offset': 17, 'end_offset': 28}]"
ID_914970402060988416,"Still havent heard from some family members- looking for Carmen and Effendi Garcia, Q6 calle 10 Sabana Grande. Any help is greatly appreciated. Please RT #puertorico #HurricaneMaria #pleasehelp","[{'text': 'Sabana Grande', 'type': 'City/town', 'start_offset': 96, 'end_offset': 109}, {'text': 'puertorico', 'type': 'Island', 'start_offset': 155, 'end_offset': 165}]"
ID_912462925410869248,"23,000 Dominicans out of their homes after #HurricaneMaria & the River Yuna floods increased in the last hours","[{'text': 'River Yuna', 'type': 'Natural Point-of-Interest', 'start_offset': 65, 'end_offset': 75}]"
ID_914489640119304192,"87% hospitals,95% people w/no electricity, By the numbers: Hurricane Maria damage, recovery in Puerto Rico  @usatoday","[{'text': 'Puerto Rico', 'type': 'Island', 'start_offset': 95, 'end_offset': 106}]"
ID_911661536946544640,"RT @NotiUno: Hurricane Maria damaged Guajataca Dam, which is in imminent danger of failing built by Army Corps of Engineers in 1929 - @he","[{'text': 'Guajataca Dam', 'type': 'Natural Point-of-Interest', 'start_offset': 37, 'end_offset': 50}]"
ID_914149400154398720,These lovely CR ladies collected funds from CR employees and purchased a ton of needed supplies for Puerto Rico! #puertorico #hurricanemaria,"[{'text': 'Puerto Rico', 'type': 'Island', 'start_offset': 100, 'end_offset': 111}, {'text': 'puertorico', 'type': 'Island', 'start_offset': 114, 'end_offset': 124}]"
ID_910709000320290817,#politics #media #news  Entire Country Without Power After Hurricane Maria - TYT,[]
ID_913438768073527297,RT @BorundaDaniel: El Paso restaurant collecting donations to help #HurricaneMaria #PuertoRicoRelief Info in article. ἟5἟7,[]
ID_913875083550105600,"Shout out 2 @Pitbull. Loved yr perform at #HitachiNEXT, but more for your extended help to #cancer patients in Puerto Rico. #HurricaneMaria","[{'text': 'Puerto Rico', 'type': 'Island', 'start_offset': 111, 'end_offset': 122}]"
ID_914247946409058306,Hurricane Maria Puerto Rico Relief Charity Event:  via @YouTube,"[{'text': 'Puerto Rico', 'type': 'Island', 'start_offset': 16, 'end_offset': 27}]"
ID_912998758320934912,"Puerto Rico: Dam damaged by Hurricane Maria in danger of collapsing; 70,000 told to evacuate  #climatechange","[{'text': 'Puerto Rico', 'type': 'Island', 'start_offset': 0, 'end_offset': 11}]"
ID_914224284192657409,"Reinforcements on the way! 51,184 bottles of water and 25,345 meals ready-to-eat delivered by #CBP supporting Hurricane Maria relief efforts",[]
ID_910692816640233473,"Hurricane Maria has caused more damage in Puerto Rico than we can imagine. Plus, the rain just keeps on moving","[{'text': 'Puerto Rico', 'type': 'Island', 'start_offset': 42, 'end_offset': 53}]"
ID_911618712393961474,"@realDonaldTrump get puerto rico help, power, food, and resources !!!!!","[{'text': 'puerto rico', 'type': 'Island', 'start_offset': 21, 'end_offset': 32}]"
ID_914526612946857984,"Owner thankful for donations, says they will go a long way in recovery process. @wyffnews4 #SharperImage #HurricaneMaria #PuertoRico","[{'text': 'PuertoRico', 'type': 'Island', 'start_offset': 122, 'end_offset': 132}]"
ID_913045978034376704,U.S. Department of Transportation Hurricane Maria Recovery Efforts in Puerto Rico - US DOT summary  via @AddThis,"[{'text': 'Puerto Rico', 'type': 'Island', 'start_offset': 70, 'end_offset': 81}]"
ID_912310245921345537,The Devastation of Puerto Rico The damage to Puerto Rico from Hurricane Maria is staggering: There will be no f,"[{'text': 'Puerto Rico', 'type': 'Island', 'start_offset': 19, 'end_offset': 30}, {'text': 'Puerto Rico', 'type': 'Island', 'start_offset': 45, 'end_offset': 56}]"
ID_914841261353455616,RT @Ogalina: #help is desperately needed for #hurricaneirma #hurricaneharvey #hurricanemaria #hurricanerelief,[]
ID_911584665668079616,Hurricane Maria caused massive damage in Puerto Rico. Join with us and the Puero Rico Young Republicans in,"[{'text': 'Puerto Rico', 'type': 'Island', 'start_offset': 41, 'end_offset': 52}, {'text': 'Puero Rico', 'type': 'Island', 'start_offset': 75, 'end_offset': 85}]"
ID_914186066059567105,"Update: @wondermade, @feedhopenow & Buttermilk Bakery are helping. How To Help Puerto Rico After Hurricane Maria","[{'text': 'Puerto Rico', 'type': 'Island', 'start_offset': 79, 'end_offset': 90}]"
ID_912421703258689536,"I hear she is taking up a collection. #Haiti Clinton is just stirring the pot, relief did arrive, ports destroyed, Rangers flew in.","[{'text': 'Haiti', 'type': 'Country', 'start_offset': 39, 'end_offset': 44}]"
ID_914962230336212992,"USF sends doctors, opens doors to victims of Hurricane Maria",[]
ID_913791306958336000,RT @alejandrotorio: @5ChurchCHS via @ChasCityPaper on Hurricane Maria relief efforts in Puerto Rico  #Charleston #ch,"[{'text': 'Puerto Rico', 'type': 'Island', 'start_offset': 88, 'end_offset': 99}, {'text': 'Charleston', 'type': 'City/town', 'start_offset': 102, 'end_offset': 112}]"
ID_912188694504857600,Puerto Rican players across MLB search for ways to help after Hurricane Maria devastates the island,"[{'text': 'Puerto Rican', 'type': 'Island', 'start_offset': 0, 'end_offset': 12}]"
ID_912464252941815808,"I know its tempting for people to compare Hurricane Maria to Katrina, but remember that over 1,800 people died in Katrina.",[]
ID_911770283815702528,Hurricane Maria Intensifies to Category 4  Urgent need send aid immediately care of the,[]
ID_913105016352759808,"@altNOAA These deaths are on @realDonaldTrump a head, for failing to act after hurricane Maria. #murderer #WorstPresidentEver",[]
ID_910652460301275137,Hurricane Maria Destroyed Puerto Rico And Left The Island Without Power  #MAGA #MariaHurricane #PuertoRico,"[{'text': 'Puerto Rico', 'type': 'Island', 'start_offset': 26, 'end_offset': 37}, {'text': 'PuertoRico', 'type': 'Island', 'start_offset': 96, 'end_offset': 106}]"
ID_912373489016770560,Officials plead for swift aid to Puerto Rico to prevent humanitarian crisis  #PuertoRico,"[{'text': 'Puerto Rico', 'type': 'Island', 'start_offset': 33, 'end_offset': 44}, {'text': 'PuertoRico', 'type': 'Island', 'start_offset': 78, 'end_offset': 88}]"
ID_911571515824574464,We helped set up #CCRIF. The immediate payout of $19million will help #Dominica restore infrastructure in the aftermath of #HurricaneMaria,"[{'text': 'Dominica', 'type': 'Island', 'start_offset': 71, 'end_offset': 79}]"
ID_914518996401229825,"This our island after Hurricane Maria, for all latinos heaters, we arent asking for money. WE NEED WATER AND FOOD.",[]
ID_913499261555417089,Were collecting supplies for @FriendsOfPR & @UNIDOSxPR. Donate items to a local @Sprint4FL store now - 10/8  ὤF἟5἟7#HurricaneMaria #hurricanerelief #UnitedforPR #BuildPuertoRico,[]
ID_913106526486667264,@ALT_uscis Drinking water from streams where they may have been animal carcases upstream. In danger of disease outbreaks. #PuertoRico #HurricaneMaria,"[{'text': 'PuertoRico', 'type': 'Island', 'start_offset': 123, 'end_offset': 133}]"
ID_911975743583920128,RT @NYCMayorsOffice: There are a lot of ways you can send help to those in need after Hurricane Maria.,[]
ID_911978164527685633,Recovery supplies needed in most areas of Puerto Rico.,"[{'text': 'Puerto Rico', 'type': 'Island', 'start_offset': 42, 'end_offset': 53}]"
ID_913534481839067136,ICYMI: Villanova students from Puerto Rico are raising money for those affected by Hurricane Maria.,"[{'text': 'Puerto Rico', 'type': 'Island', 'start_offset': 31, 'end_offset': 42}]"
ID_913978139243696129,@sexiirican86 Retweet: Items Needed: Non Perishable Food Womens Toiletries Soap Deodorant Clothes WATER!!! #PuertoRico #HurricaneMaria #Donate,"[{'text': 'PuertoRico', 'type': 'Island', 'start_offset': 108, 'end_offset': 118}]"
ID_913157200385921024,"@realDonaldTrump We have fight in every war, and our blood have been drained. We need help now!!! #PuertoRico #HurricaneMaria","[{'text': 'PuertoRico', 'type': 'Island', 'start_offset': 99, 'end_offset': 109}]"
ID_913790483587059712,"Puerto Rico, short on fuel, cannot deliver food and medicine to the victims of Hurricane Maria","[{'text': 'Puerto Rico', 'type': 'Island', 'start_offset': 0, 'end_offset': 11}]"
ID_910631558402510848,RT @alexmorgan13: Really terrible to see damage from Dominica and the path Hurricane Maria is taking toward Puerto Rico. Be safe everyone!,"[{'text': 'Dominica', 'type': 'Country', 'start_offset': 53, 'end_offset': 61}, {'text': 'Puerto Rico', 'type': 'Island', 'start_offset': 108, 'end_offset': 119}]"
ID_914663137101729792,RT @politstrip: More people died in #SanDiego from #HepatitisA than in #PuertoRico from #HurricaneMaria ἲA,"[{'text': 'SanDiego', 'type': 'City/town', 'start_offset': 37, 'end_offset': 45}, {'text': 'PuertoRico', 'type': 'Island', 'start_offset': 72, 'end_offset': 82}]"
ID_913013677007151105,"Thoughts? #PuertoRico’s electricity systems are badly damaged after #HurricaneMaria, and nearly","[{'text': 'PuertoRico', 'type': 'Island', 'start_offset': 11, 'end_offset': 21}]"
ID_912396168679768064,"Hurricane Maria destroyed Puerto Ricos, which IS part of the United States, radar, a critical tool for forecasting","[{'text': 'Puerto Ricos', 'type': 'Island', 'start_offset': 26, 'end_offset': 38}, {'text': 'United States', 'type': 'Country', 'start_offset': 61, 'end_offset': 74}]"
ID_913177813129105409,"@ryl5858 Due to the severe damage caused by Hurricane Maria and the impact on Sprint’s network, technical staff have mobilized to Puerto Rico. -EM","[{'text': 'Puerto Rico', 'type': 'Island', 'start_offset': 130, 'end_offset': 141}]"
ID_912325874824998912,"We need to help fix the airport in PR so help to arrive.PR is a Caribbean hub,we would also be helping our ἳ4 neighbors! #HurricaneMaria","[{'text': 'PR', 'type': 'Island', 'start_offset': 35, 'end_offset': 37}, {'text': 'PR', 'type': 'Island', 'start_offset': 56, 'end_offset': 58}]"
ID_914990872340570112,".@AndersonCooper anchors coverage from San Juan, Puerto Rico, as relief efforts continue since Hurricane Maria","[{'text': 'San Juan', 'type': 'City/town', 'start_offset': 39, 'end_offset': 47}, {'text': 'Puerto Rico', 'type': 'Island', 'start_offset': 49, 'end_offset': 60}]"
ID_912163234228113409,"RT @sotomayor2020: pleaded with their governor for things they need most: drinking water, prescription drugs, gas, oxygen, satphones. htt",[]
ID_910791867368796161,"Hurricane Maria has struck Puerto Rico, flooding streets, damaging buildings, and bringing down power lines","[{'text': 'Puerto Rico', 'type': 'Island', 'start_offset': 27, 'end_offset': 38}]"
ID_911572044818591745,#Arecibo #RadioTelescope Damaged and #Closed by Hurricane #Maria #PuertoRico  #USA #Hurricane #huracan @SETIInstitute,"[{'text': 'PuertoRico', 'type': 'Island', 'start_offset': 66, 'end_offset': 76}, {'text': 'USA', 'type': 'Country', 'start_offset': 79, 'end_offset': 82}]"
ID_914831394857242624,FDA Works To Prevent Global Drug Shortages From Damage To Puerto Rico Factories via @forbes,"[{'text': 'Puerto Rico', 'type': 'Island', 'start_offset': 58, 'end_offset': 69}]"
ID_912134579976327173,"RT @CrnchyMama: Why has .@POTUS not sent help? No photo op fly-in 2 see damage 1st-hand, pretend 2 load supplies on truck? SAD!",[]
ID_911620817426907141,"As Maria Barrels North, Puerto Rico Surveys the Damage","[{'text': 'Puerto Rico', 'type': 'Island', 'start_offset': 24, 'end_offset': 35}]"
ID_913808339670364160,"During Katrina, 1 storm w.100s of deaths, as opposed to Irma & Maria, 2 storms|12 deaths..I think President Trump: doing great job. #maga",[]
ID_913823758347128832,"Hurricane Maria damaged or destroyed ice plants, ports, docks, runways, air traffic control systems. Every system you need to respond",[]
ID_913769551812337665,Hurricane Maria.. all of the infrastructure damage and devastation .. ..35 foot waves..such,[]
ID_913129517908156416,@PRFAA #PuertoRico aid stuck in containers #PuertoRicoRelief #HuracanMaria #HurricaneMaria #PRFAADisasterRelief #PRFAA #disgrace #HelpNow,"[{'text': 'PuertoRico', 'type': 'Island', 'start_offset': 8, 'end_offset': 18}]"
ID_914859980431482881,An update from @DiscosDiaspora on the situation in Puerto Rico. Includes links to relief funds & fund-raising music:,"[{'text': 'Puerto Rico', 'type': 'Island', 'start_offset': 51, 'end_offset': 62}]"
ID_914150147017371654,RT @artangeI: Asking my followers with the financial means to do so to donate to Puerto Rico. Link to @princessnokiaa GoFundMe: .,"[{'text': 'Puerto Rico', 'type': 'Island', 'start_offset': 81, 'end_offset': 92}]"
ID_910621353245593600,#StMaarten has been spared additional damage as most of the category 5 #HurricaneMaria passed South of the island.,"[{'text': 'South of the island', 'type': 'Island', 'start_offset': 94, 'end_offset': 113}]"
ID_910577272473743360,As Puerto Rico must deal with Hurricane Maria please keep in mind Buffalos large Puerto Rican population and help as you can.,"[{'text': 'Puerto Rico', 'type': 'Island', 'start_offset': 3, 'end_offset': 14}]"
ID_914876840589893632,RT @julito77: The death toll from #HurricaneMaria in #PuertoRico is not 16. The PR govt and @DHSgov have both said that it will likely ris,"[{'text': 'PuertoRico', 'type': 'Country', 'start_offset': 54, 'end_offset': 64}]"
ID_914628025186160642,"RT @1o5CleanEnergy: ⚡ Help us, we are dying says Mayor of San Juan, Puerto Rico  #HurricaneMaria Victims of #Cli","[{'text': 'San Juan', 'type': 'City/town', 'start_offset': 58, 'end_offset': 66}, {'text': 'Puerto Rico', 'type': 'Island', 'start_offset': 68, 'end_offset': 79}]"
ID_914656058584502274,go buy that comp all of the proceeds are going to the hurricane maria community relief and recovery fund,[]
ID_912345647797370880,Airmen assess #HurricaneMaria damage at Muniz Air National Guard Base in #PuertoRico and #evacuate civilians.,"[{'text': 'PuertoRico', 'type': 'Island', 'start_offset': 74, 'end_offset': 84}]"
ID_910673991152668678,Hurricane Maria Destroyed Puerto Rico And Left The Island Without Power:  via @YouTube,"[{'text': 'Puerto Rico', 'type': 'Island', 'start_offset': 26, 'end_offset': 37}]"
ID_912288653342380033,RT @JuhaPalosaari1: #JenniferLopez donates $1m to #PuertoRico hurricane recovery effort. #charity #HurricaneMaria #HurricaneIrma .,"[{'text': 'PuertoRico', 'type': 'Island', 'start_offset': 51, 'end_offset': 61}]"
ID_912030804527771649,Join us at #lafabricacentral to raise #funds for #PuertoRico . Donate $30 and eat great food! #PuertoRicoStrong #hurricanemaria,"[{'text': 'PuertoRico', 'type': 'Island', 'start_offset': 50, 'end_offset': 60}]"
ID_913487726577627136,Hurricane Maria: Facebook donates $1.5million to Puerto Rico among other relief efforts,"[{'text': 'Puerto Rico', 'type': 'Island', 'start_offset': 49, 'end_offset': 60}]"
ID_912164015014588416,"@kobebryant you were going to help for a good cause in Puerto Rico w/ The Autism Training Center, but we need help now with Hurricane Maria.","[{'text': 'Puerto Rico', 'type': 'Island', 'start_offset': 55, 'end_offset': 66}]"
ID_913361596981891072,Official: Soldiers from the #101st CAB are preparing to deploy to Puerto Rico for Hurricane Maria relief,"[{'text': 'Puerto Rico', 'type': 'Island', 'start_offset': 66, 'end_offset': 77}]"
ID_913840822436663296,"RT @jennykellyedu: Did you attend #ASA2012, #NWSA2014, or #LASA2015? Exercise postconference accountability and donate to @tsalud here. htt",[]
ID_914993309675900933,"RT @DrBashir2017: No electricty, no cell phone coverage, no drinking waterἙ8 Make a difference today! #HelpPuertoRico Ὁ9ὉCὉA",[]
ID_913836726803734528,"Beginning tomorrow: Join the Herald and @W_A_S_B for #WeekOfRelief, collecting hurricane aid for those affected by Harvey, Irma and Maria",[]
ID_911569163168174080,Cuomo Leading Delegation To #PuertoRico To Assist With Hurricane Maria Recovery Efforts | Latest News World,"[{'text': 'PuertoRico', 'type': 'Island', 'start_offset': 29, 'end_offset': 39}]"
ID_913155243491328000,"@NBCNews My childhood friends have no drinking water, running out of food. This should be your top story everyday! #HurricaneMaria",[]
ID_912289015231078401,Donate to support Puerto Rico in this time of crisis:  #hurricanemaria #hurricanerelief,"[{'text': 'Puerto Rico', 'type': 'Island', 'start_offset': 18, 'end_offset': 29}]"
ID_910676832592293889,RT @margara03: Friends in NYC - you can donate to Puerto Rico Hurricane Maria relief efforts here ❤️,"[{'text': 'NYC', 'type': 'City/town', 'start_offset': 26, 'end_offset': 29}, {'text': 'Puerto Rico', 'type': 'Island', 'start_offset': 50, 'end_offset': 61}]"
ID_912382087746990081,RT @johnlundin: Lets get #PuertoRico trending! They need our help. Please R/T,"[{'text': 'PuertoRico', 'type': 'Island', 'start_offset': 26, 'end_offset': 36}]"
ID_910585987146878977,News article: Puerto Rico destroyed by hurricane. Also news article: Maria posed no immediate threat to the U.S. ὤ4ὤ4ὤ4ὤ4ὤ4,"[{'text': 'Puerto Rico', 'type': 'Island', 'start_offset': 14, 'end_offset': 25}, {'text': 'U.S.', 'type': 'Country', 'start_offset': 108, 'end_offset': 112}]"
ID_913248628461928448,"RT @4mcnolo: @TheDailyShow Please spread the word about the #crisis in #pr #hurricanemaria, #JonesAct fellow americans need HELP! ὤFἿC἟5἟7",[]
ID_912159813278355456,"Folks, pay attention to whats happening to fellow American citizens in Puerto Rico! Congress needs to act soon to provide relief funding!","[{'text': 'Puerto Rico', 'type': 'Island', 'start_offset': 71, 'end_offset': 82}]"
ID_913828657784918017,Appx 150 soldiers from the 4th ID 4th Sustainment Brigade are being deployed in Hurricane Maria relief efforts,[]
ID_912271216194572288,Tropical Storm Warning issued for coast of North Carolina as Maria moves northward  via @WTKR3,"[{'text': 'North Carolina', 'type': 'State', 'start_offset': 43, 'end_offset': 57}]"
ID_913170349528961024,RT @playingwithu: Tweet me a screenshot of your donation for Hurricane Maria relief to  or  &,[]
ID_913054707177967616,#Trump #FEMA #Redcross must do better and delivery #PuertoRicoRelief faster. People are dying. #Resist must increase pressure for Aid.,[]
ID_910563701828317186,RT @maximccan: 200+ people died in Mexico and Hurricane Maria is doing damage as we speak and yet we are worried about Ivankas use of the,"[{'text': 'Mexico', 'type': 'Country', 'start_offset': 35, 'end_offset': 41}]"
ID_911564747123896320,RT @highlyanne: From yesterday: Structural Damage at Guajataca Dam Prompts Evacuations in Puerto Rico,"[{'text': 'Guajataca', 'type': 'Natural Point-of-Interest', 'start_offset': 53, 'end_offset': 62}, {'text': 'Puerto Rico', 'type': 'Island', 'start_offset': 90, 'end_offset': 101}]"
ID_913037975075872768,RT @FTLReview: Food For The Poor Ships Donations To Islands #foodforthepoor #hurricanemaria,[]
ID_912402468901965824,Help those affected by #HurricaneMaria in Puerto Rico. Drop off personal and home items at collection sites across Erie Co. #HelpPuertoRico,"[{'text': 'Puerto Rico', 'type': 'Island', 'start_offset': 42, 'end_offset': 53}]"
ID_913025033689272320,The colorful town made famous in the #Despacito music video has been badly damaged by Hurricane #Maria.,[]
ID_913229850781061125,Officials in #PuertoRico say the destruction from Hurricane #Maria has set the island back 20 to 30 years. #twc,"[{'text': 'PuertoRico', 'type': 'Island', 'start_offset': 14, 'end_offset': 24}]"
ID_913828162278232066,"Waiting for manufacturing details, all profits go towards helping hurricane victims back home #Maria #PuertoRicoRelief #FuckMaria",[]
ID_912336696297041920,"In a matter of hours, Hurricane Maria wiped out about 80% of the crop value in Puerto Ricoalready imports about 85% of its food.","[{'text': 'Puerto Ricoalready', 'type': 'Island', 'start_offset': 79, 'end_offset': 97}]"
ID_913745984483581954,RT @EPA: During our site visits we determined there was no significant damage by Hurricane Maria at these three sites in PR.,[]
ID_911588617851719680,15 dead and 20 missing on Dominica after #HurricaneMaria #ThursdayThoughts Help Your Neighbours & Animals ὀ8ᾘ9ὃ6ᾘ5ὁF,"[{'text': 'Dominica', 'type': 'Country', 'start_offset': 26, 'end_offset': 34}]"
ID_910579372104601601,RT @MichelleKaske: #PuertoRico without power and faces $30B in damage from #Maria. With @WeatherSullivan  via @busin,"[{'text': 'PuertoRico', 'type': 'Island', 'start_offset': 20, 'end_offset': 30}]"
ID_915001660522590209,.@Esri has volunteered its #GIS expertise and tools to help out with recovery from #HurricaneMaria,[]
ID_912177884248379392,On rebuilding & relief efforts following #HurricaneIrma & #HurricaneMarias devastation.  #DHL #DHLGoHelp #Irma,[]
ID_912182449635041281,RT @prz_daily: Went through a cleaning spell and decided to donate almost 1/3rd of my old clothes to send to #HurricaneMaria and #Hurricane,[]
ID_914012344996462592,Hurricane Maria could actually cost Puerto Rico $95 Billion dollars. Donate here to help  #piusnews,"[{'text': 'Puerto Rico', 'type': 'Island', 'start_offset': 36, 'end_offset': 47}]"
ID_913014593680789505,"*Arecibo Observatory, the 2nd largest radio telescope in the world, has suffered only minor damage in the wake of Hurricane Maria.",[]
ID_913418744009035777,RT @USRealityCheck: Hurricane-ravaged islanders: We need help  #USNews #USRC,[]
ID_913177319602343938,[Clean underwear needed] How to Help Puerto Rico and Other Islands After Hurricane Maria -,"[{'text': 'Puerto Rico', 'type': 'Island', 'start_offset': 37, 'end_offset': 48}]"
ID_912463357025890304,RT @LambdaLegal: Donate at @HispanicFed. #PuertoRico #HurricaneMaria,"[{'text': 'PuertoRico', 'type': 'Island', 'start_offset': 42, 'end_offset': 52}]"
ID_912337337643913217,RT @Equip_Dealers: An estimated 80% of Puerto Ricos crops destroyed by Hurricane Maria.,"[{'text': 'Puerto Ricos', 'type': 'Island', 'start_offset': 39, 'end_offset': 51}]"
ID_913787941444624385,"Spanish-born @chefjoseandres has landed in Puerto Rico, providing meals to staff aiding #HurricaneMaria efforts:","[{'text': 'Puerto Rico', 'type': 'Island', 'start_offset': 43, 'end_offset': 54}]"
ID_910687886445494273,"HURRICANE MARIA FOOTAGE, DAMAGE, CAUGHT ON CAMERA  via @YouTube",[]
ID_912362429052522496,"#PuertoRico #gofundme For parents of Padre Angel, whose family home was destroyed in #HurricaneMaria","[{'text': 'PuertoRico', 'type': 'Island', 'start_offset': 1, 'end_offset': 11}]"
ID_912298691347779584,RT @orlandomayor: Our compassionate community can help the @PRFAA get needed supplies to Puerto Rico.,"[{'text': 'Puerto Rico', 'type': 'Island', 'start_offset': 89, 'end_offset': 100}]"
ID_912249904243904512,RT @NUJScotland2: The Government of Dominica desperately needs your support. Help the people affected by Hurricane Maria.,"[{'text': 'Dominica', 'type': 'Island', 'start_offset': 36, 'end_offset': 44}]"
ID_914227435524296707,HELP US. WE ARE DYING. #HurricaneMaria #PuertoRico,"[{'text': 'PuertoRico', 'type': 'Island', 'start_offset': 40, 'end_offset': 50}]"
ID_912978642132766720,RT @KCKnowss: Crazy af how 4 years ago I was living in Puerto Rico & Hurricane Maria really came through & destroyed tons of shit.,"[{'text': 'Puerto Rico', 'type': 'Island', 'start_offset': 55, 'end_offset': 66}]"
ID_914474107118301184,"Were working hand-in-hand aiding victims of Hurricane Maria, Irma, and Harvey. head to  to learn how to help too",[]
ID_912328788490547200,"RT @wcti12: NEW: Hurricane Maria remains a Category 1, leaving parts of eastern North Carolina under a Tropical Storm Warning.","[{'text': 'North Carolina', 'type': 'State', 'start_offset': 80, 'end_offset': 94}]"
ID_914562294352408582,RT @MarthaMilne1: Check it out! I donated to Hurricane Maria Animal Fund -  via @gofundme Please help pet survivo,[]
ID_913942551035568128,"If you are in #DC, join us this Sunday as we run a 5K for #HurricaneMaria Recovery Fund. Register now","[{'text': 'DC', 'type': 'State', 'start_offset': 15, 'end_offset': 17}]"
ID_910627260947927046,RT @NPR: Puerto Ricos governor announces a 6 p.m. curfew on the island amid Hurricane Maria,"[{'text': 'Puerto Ricos', 'type': 'Island', 'start_offset': 9, 'end_offset': 21}]"
